[
  {
    "eligibility_id": "ELG-V01-SVC-001",
    "service_id": "V01-SVC-001",
    "applicable_entity_types": [
      "PVT_LTD",
      "LLP",
      "PARTNERSHIP"
    ],
    "prerequisites": [
      "Entity incorporated as Private Limited Company, LLP, or registered Partnership Firm within the preceding 10 years",
      "Turnover has not exceeded ₹100 crore in any preceding financial year since incorporation",
      "Entity is working towards innovation, development, or improvement of products, processes, or services, or scalable business model with high employment/wealth potential",
      "Entity was not formed by splitting up or reconstruction of a business already in existence"
    ],
    "required_documents": [
      "Certificate of Incorporation / Registration Certificate",
      "Pitch deck and write-up on innovation/scalability with website or mobile application links",
      "CA certified net worth certificate (mandatory for Section 56(2)(viib) angel tax exemption Form 2)"
    ],
    "exceptions_and_limitations": [
      "Sole proprietorships, public limited companies, and trusts are ineligible for DPIIT recognition",
      "Entities formed by splitting up or reconstruction of an existing business are ineligible"
    ],
    "jurisdiction": "IN-CENTRAL",
    "source_id": "SRC-DPIIT-001",
    "verification_status": "SOURCE_IDENTIFIED",
    "last_verified_at": null,
    "next_review_at": "2027-04-01",
    "primary_vertical_id": "V01",
    "statutory_provision": "DPIIT Notification No. G.S.R. 127(E) dated 19 Feb 2019 read with Section 56(2)(viib) of Income Tax Act, 1961",
    "operational_recommendations": [
      "Maintain contemporaneous digital pitch decks and investor pitch documentation",
      "Re-verify DPIIT entity turnover cap quarterly"
    ],
    "unresolved_questions": [],
    "checked_date": "2026-10-17",
    "notes": "Statutory source identified under SRC-DPIIT-001 (DPIIT Notification No. G.S.R. 127(E) dated 19 Feb 2019 read with Section 56(2)(viib) of Income Tax Act, 1961). Preserved strictly as SOURCE_IDENTIFIED; not legally verified. Qualified legal review is required before publication."
  },
  {
    "eligibility_id": "ELG-V01-SVC-002",
    "service_id": "V01-SVC-002",
    "applicable_entity_types": [
      "LLP"
    ],
    "prerequisites": [
      "Minimum two designated partners who are natural persons, with at least one designated partner resident in India (Section 7 LLP Act, 2008)",
      "Valid DPIN/DIN and Class 3 Digital Signature Certificate (DSC) for designated partners",
      "Proposed LLP name complying with name reservation guidelines under Rule 18 of LLP Rules, 2009",
      "Registered office premises located in India (Section 13)"
    ],
    "required_documents": [
      "PAN cards and identity proofs (Passport / Voter ID / DL) of all partners",
      "Residential address proofs (< 2 months old: bank statement / utility bill) of all partners",
      "Registered office utility bill (< 2 months old) and signed owner No Objection Certificate (NOC)",
      "Executed LLP Agreement stamped per state stamp act and filed in Form 3 within 30 days of incorporation"
    ],
    "exceptions_and_limitations": [
      "Bodies corporate acting as partner must appoint an individual natural person as their designated partner nominee",
      "Non-profit or charitable objects are prohibited; LLPs must be formed with a view to profit"
    ],
    "jurisdiction": "IN-CENTRAL",
    "source_id": "SRC-MCA-001",
    "verification_status": "SOURCE_IDENTIFIED",
    "last_verified_at": null,
    "next_review_at": "2027-04-01",
    "primary_vertical_id": "V01",
    "statutory_provision": "Sections 11 & 12 of Limited Liability Partnership Act, 2008 read with Rule 8 & 11 of LLP Rules, 2009 (FiLLiP Form)",
    "operational_recommendations": [
      "Draft detailed LLP profit-sharing and capital withdrawal schedules prior to FiLLiP filing",
      "Verify partner DSC token validity 30 days prior"
    ],
    "unresolved_questions": [],
    "checked_date": "2026-10-17",
    "notes": "Statutory source identified under SRC-MCA-001 (Sections 11 & 12 of Limited Liability Partnership Act, 2008 read with Rule 8 & 11 of LLP Rules, 2009 (FiLLiP Form)). Preserved strictly as SOURCE_IDENTIFIED; not legally verified. Qualified legal review is required before publication."
  },
  {
    "eligibility_id": "ELG-V01-SVC-003",
    "service_id": "V01-SVC-003",
    "applicable_entity_types": [
      "PVT_LTD",
      "PUBLIC_UNLISTED",
      "OPC",
      "LLP",
      "PARTNERSHIP",
      "PROPRIETORSHIP",
      "TRUST",
      "SOCIETY"
    ],
    "prerequisites": [
      "Enterprise falls within Micro, Small, or Medium classification thresholds based on composite investment and turnover criteria under MSMED Act, 2006",
      "Valid Aadhaar number of proprietor (for proprietorship), managing partner (for partnership), or authorized signatory (for company/LLP)",
      "PAN of the enterprise linked with Aadhaar, and GSTIN (where GST registration is legally mandatory)"
    ],
    "required_documents": [
      "Aadhaar number and PAN of the applicant / enterprise",
      "Bank account number and IFSC code of the business entity",
      "National Industry Classification (NIC) 2-digit, 4-digit, and 5-digit business activity codes",
      "Investment and turnover figures matching Income Tax and GST returns"
    ],
    "exceptions_and_limitations": [
      "Enterprises engaged exclusively in speculative, gambling, or negative-list activities are ineligible",
      "A single enterprise cannot obtain more than one Udyam registration; multiple units must be added under one Udyam number"
    ],
    "jurisdiction": "IN-CENTRAL",
    "source_id": "SRC-MSME-001",
    "verification_status": "SOURCE_IDENTIFIED",
    "last_verified_at": null,
    "next_review_at": "2027-04-01",
    "primary_vertical_id": "V01",
    "statutory_provision": "Sections 7 & 8 of Micro, Small and Medium Enterprises Development Act, 2006 read with Ministry of MSME Notification S.O. 2119(E) dated 26 June 2020",
    "operational_recommendations": [
      "Ensure Udyam registration matches primary GST return HSN/NIC activity descriptions",
      "Review enterprise investment valuation annually"
    ],
    "unresolved_questions": [],
    "checked_date": "2026-10-17",
    "notes": "Statutory source identified under SRC-MSME-001 (Sections 7 & 8 of Micro, Small and Medium Enterprises Development Act, 2006 read with Ministry of MSME Notification S.O. 2119(E) dated 26 June 2020). Preserved strictly as SOURCE_IDENTIFIED; not legally verified. Qualified legal review is required before publication."
  },
  {
    "eligibility_id": "ELG-V01-SVC-004",
    "service_id": "V01-SVC-004",
    "applicable_entity_types": [
      "OPC"
    ],
    "prerequisites": [
      "Exactly one natural person who is an Indian citizen (resident or non-resident) as sole subscriber and director (Section 2(62) & 3(1)(c) Companies Act, 2013)",
      "Nomination of another natural Indian citizen who gives prior written consent in Form INC-3 to act as nominee in the event of subscriber death or incapacity",
      "The individual subscriber and nominee must not be a member or nominee of any other OPC"
    ],
    "required_documents": [
      "PAN card, identity proof, and residential address proof (< 2 months old) of subscriber and nominee",
      "Written consent of nominee in Form INC-3",
      "Digital Signature Certificate (DSC Class 3) of the subscriber",
      "Proof of registered office premises (< 2 months old) with utility bill, rent agreement, and owner NOC"
    ],
    "exceptions_and_limitations": [
      "Minors cannot become member or nominee of an OPC, or hold share with beneficial interest",
      "OPC cannot be incorporated or converted into a Section 8 non-profit company",
      "OPC cannot carry out non-banking financial investment activities, including investment in securities of other corporate bodies"
    ],
    "jurisdiction": "IN-CENTRAL",
    "source_id": "SRC-MCA-001",
    "verification_status": "SOURCE_IDENTIFIED",
    "last_verified_at": null,
    "next_review_at": "2027-04-01",
    "primary_vertical_id": "V01",
    "statutory_provision": "Section 2(62) and Section 3(1)(c) of Companies Act, 2013 read with Rule 3 of Companies (Incorporation) Rules, 2014",
    "operational_recommendations": [
      "Nominate an alternate nominee director in internal governance charter",
      "Prepare conversion readiness checklist for future growth"
    ],
    "unresolved_questions": [],
    "checked_date": "2026-10-17",
    "notes": "Statutory source identified under SRC-MCA-001 (Section 2(62) and Section 3(1)(c) of Companies Act, 2013 read with Rule 3 of Companies (Incorporation) Rules, 2014). Preserved strictly as SOURCE_IDENTIFIED; not legally verified. Qualified legal review is required before publication."
  },
  {
    "eligibility_id": "ELG-V01-SVC-005",
    "service_id": "V01-SVC-005",
    "applicable_entity_types": [
      "PARTNERSHIP"
    ],
    "prerequisites": [
      "Minimum 2 partners (maximum 50 partners under Section 464 Companies Act, 2013 read with Rule 10 Companies (Miscellaneous) Rules, 2014)",
      "Competence to contract under Section 11 of the Indian Contract Act, 1872",
      "Lawful business carried on by all or any of them acting for all to share the profits of a business (Section 4 Indian Partnership Act, 1932)"
    ],
    "required_documents": [
      "Duly executed Partnership Deed executed on appropriate state non-judicial stamp paper and notarized",
      "Application for registration in Form A signed by all partners or their specially authorized agents",
      "Identity proofs (PAN, Passport / Voter ID) and address proofs of all partners",
      "Proof of principal place of business and all branch offices (utility bill, lease deed, NOC)"
    ],
    "exceptions_and_limitations": [